{
	"name": "rentals-pdf",
	"version": "1.0.0",
	"description": "Generate a PDF from a rental database",
	"trigger": {
		"http": {
			"method": "GET",
			"path": "/rentals-pdf",
			"accept": "application/json"
		}
	},
	"steps": [
		{
			"id": "get-rentals",
			"use": "postgres-query",
			"type": "module",
			"inputs": {
				"host": "localhost",
				"port": 5432,
				"database": "dvdrental",
				"user": "postgres",
				"password": "example",
				"query": "SELECT f.title as product, SUM(p.amount) as total, ROUND(SUM(p.amount) / COUNT(*), 2) as price, DATE_TRUNC('month', r.rental_date) AS rental_month, COUNT(*) AS quantity FROM rental r INNER JOIN inventory i ON i.inventory_id = r.inventory_id INNER JOIN film f ON f.film_id = i.film_id INNER JOIN payment p ON p.rental_id = r.rental_id GROUP BY r.inventory_id, rental_month, f.title ORDER BY total DESC LIMIT 20;"
			}
		},
		{
			"id": "format-data",
			"use": "array-map",
			"type": "module",
			"inputs": {
				"array": {
					"$ref": {
						"step": "get-rentals",
						"path": ["data"]
					}
				},
				"map": "{ product: data.product, quantity: parseInt(data.quantity), total: parseInt(data.total), price: parseInt(data.price), rental_month: data.rental_month }"
			}
		},
		{
			"id": "generate-pdf",
			"use": "generate-pdf",
			"type": "runtime.python3",
			"inputs": {
				"title": "Top 20 Films by Revenue",
				"sales_data": {
					"$ref": {
						"step": "format-data",
						"path": []
					}
				}
			}
		},
		{
			"id": "decode",
			"use": "base64-pdf",
			"type": "module",
			"inputs": {
				"base64": "${ctx.prev.data.pdf_base64}"
			}
		},
		{
			"id": "response",
			"use": "@blokjs/respond",
			"type": "module",
			"inputs": {
				"body": {
					"$ref": {
						"step": "decode",
						"path": []
					}
				},
				"contentType": "application/pdf",
				"headers": {
					"Content-Disposition": "attachment; filename=\"rentals.pdf\""
				}
			}
		}
	]
}
