{
	"name": "launches-by-year",
	"version": "1.0.0",
	"description": "Get launches by year",
	"trigger": {
		"http": {
			"method": "GET",
			"path": "/launches-by-year",
			"accept": "application/json"
		}
	},
	"steps": [
		{
			"id": "api",
			"use": "@blokjs/api-call",
			"type": "module",
			"inputs": {
				"url": "https://ll.thespacedevs.com/2.3.0/launches/?format=json&year=${ctx.request.query.dob ? new Date(ctx.request.query.dob).getYear() : new Date('2000-01-01').getYear()}",
				"method": "GET",
				"headers": {
					"Content-Type": "application/json"
				},
				"responseType": "application/json"
			}
		}
	]
}
