{
	"name": "MongoDB CRUD API",
	"version": "1.0.0",
	"description": "Provides a RESTful API to interact dynamically with MongoDB collections.",
	"trigger": {
		"http": {
			"method": "ANY",
			"path": "/mongo/:collection/:id?",
			"accept": "application/json"
		}
	},
	"steps": [
		{
			"id": "mongodb_query",
			"use": "mongodb-query",
			"type": "module",
			"inputs": {
				"collection": "${ctx.request.params.collection}",
				"data": {
					"$ref": {
						"step": "@trigger",
						"path": [
							"body"
						]
					}
				},
				"id": "${ctx.request.params.id}"
			}
		}
	]
}
