{
	"name": "Agent Message",
	"version": "1.0.0",
	"description": "v0.6.10 — POST handler for the agentic chat. Loads prior conversation from Redis, runs the OpenAI tool-calling loop via @blokjs/llm-agent with two demo tools (weather + calculator), persists the new turn back to Redis with a 24h TTL. The agent loop streams `token`, `tool_call`, and `tool_result` events to the SSE bus channel `agent:<sid>`; the agent-stream workflow fans them out to the browser. Set OPENROUTER_API_KEY and have Redis reachable at REDIS_URL before exercising. Tool endpoints assume the deployment is reachable at http://localhost:4000 — change to a public URL or BLOK_SELF_BASE_URL interpolation when deploying.",
	"trigger": {
		"http": {
			"method": "POST",
			"path": "/agent/:sessionId/message",
			"accept": "application/json"
		}
	},
	"steps": [
		{
			"id": "load-history",
			"use": "@blokjs/redis-kv",
			"type": "module",
			"inputs": {
				"action": "get",
				"key": {
					"$tpl": [
						"agent:",
						{
							"$ref": {
								"step": "@trigger",
								"path": ["params", "sessionId"]
							}
						},
						":history"
					]
				}
			}
		},
		{
			"id": "agent",
			"use": "@blokjs/llm-agent",
			"type": "module",
			"inputs": {
				"channel": {
					"$tpl": [
						"agent:",
						{
							"$ref": {
								"step": "@trigger",
								"path": ["params", "sessionId"]
							}
						},
						""
					]
				},
				"apiKey": "js/process.env.OPENROUTER_API_KEY",
				"model": "js/process.env.OPENROUTER_MODEL || 'openai/gpt-4o-mini'",
				"messages": "js/[{ role: 'system', content: 'You are a helpful agent with two tools: get_weather(city) returns current weather; calculate(expression) evaluates arithmetic. Use them when the user asks weather or math questions. Be concise.' }, ...(ctx.state['load-history']?.value || []), { role: 'user', content: ctx.request.body.message }]",
				"tools": [
					{
						"name": "get_weather",
						"description": "Returns the current weather for a given city.",
						"parameters": {
							"type": "object",
							"properties": {
								"city": {
									"type": "string",
									"description": "City name, e.g. 'San Francisco'"
								}
							},
							"required": ["city"]
						},
						"endpoint": "http://localhost:4000/tools/weather"
					},
					{
						"name": "calculate",
						"description": "Evaluates a JavaScript arithmetic expression and returns the numeric result.",
						"parameters": {
							"type": "object",
							"properties": {
								"expression": {
									"type": "string",
									"description": "Arithmetic expression, e.g. '17 * 23' or '(120 + 45) / 3'"
								}
							},
							"required": ["expression"]
						},
						"endpoint": "http://localhost:4000/tools/calculator"
					}
				],
				"maxIterations": 10
			}
		},
		{
			"id": "save-history",
			"use": "@blokjs/redis-kv",
			"type": "module",
			"inputs": {
				"action": "set",
				"key": {
					"$tpl": [
						"agent:",
						{
							"$ref": {
								"step": "@trigger",
								"path": ["params", "sessionId"]
							}
						},
						":history"
					]
				},
				"value": "js/[...(ctx.state['load-history']?.value || []), { role: 'user', content: ctx.request.body.message }, { role: 'assistant', content: ctx.state.agent.fullText }]",
				"ttlMs": 86400000
			},
			"ephemeral": true
		},
		{
			"id": "respond",
			"use": "@blokjs/expr",
			"type": "module",
			"inputs": {
				"expression": "({ ok: true, fullText: ctx.state.agent.fullText, finishReason: ctx.state.agent.finishReason, iterations: ctx.state.agent.iterations, toolCalls: ctx.state.agent.toolCalls })"
			}
		}
	]
}
